{
  "id": "qc-01",
  "kind": "qc_report",
  "inputs": {
    "captures": [
      "f0001",
      "f0002"
    ],
    "products": [
      "fusion-01"
    ]
  },
  "software": {
    "name": "example-qc",
    "version": "0.1"
  },
  "created": "2026-10-13T09:00:00Z",
  "files": [
    {
      "role": "report",
      "path": "report.json"
    }
  ]
}
